{
  "$schema": "https://json-schema.org/draft/2020-12/schema",
  "$id": "urn:srcos:agent-machine:schema:interaction-safety-pack:v0.1.0",
  "title": "InteractionSafetyPack",
  "description": "Secret-free interaction safety contract for typed roles, rooms, communication primitives, incident severity, data planes, jurisdiction packs, and launch gates.",
  "type": "object",
  "additionalProperties": false,
  "required": ["specVersion", "id", "kind", "domain", "roles", "spaces", "communicationPrimitives", "nonNegotiables", "incidentSeverity", "dataGovernance", "jurisdiction", "launchGate", "receiptSafety", "issuedAt"],
  "properties": {
    "specVersion": {"type": "string", "const": "0.1.0"},
    "id": {"type": "string", "pattern": "^urn:srcos:agent-machine:interaction-safety-pack:[a-z0-9][a-z0-9-]*$"},
    "kind": {"type": "string", "const": "InteractionSafetyPack"},
    "domain": {"type": "string"},
    "roles": {"type": "array", "minItems": 1, "items": {"type": "string"}, "uniqueItems": true},
    "spaces": {
      "type": "array",
      "minItems": 1,
      "items": {
        "type": "object",
        "additionalProperties": false,
        "required": ["name", "minorAccess"],
        "properties": {
          "name": {"type": "string"},
          "minorAccess": {"type": "string", "enum": ["allowed", "read-only", "blocked", "not-applicable"]}
        }
      }
    },
    "communicationPrimitives": {
      "type": "array",
      "minItems": 1,
      "items": {
        "type": "object",
        "additionalProperties": false,
        "required": ["name", "allowed", "safetyProperties"],
        "properties": {
          "name": {"type": "string"},
          "allowed": {"type": "boolean"},
          "safetyProperties": {"type": "array", "items": {"type": "string"}, "uniqueItems": true}
        }
      }
    },
    "nonNegotiables": {"type": "array", "minItems": 1, "items": {"type": "string"}, "uniqueItems": true},
    "incidentSeverity": {
      "type": "array",
      "minItems": 1,
      "items": {
        "type": "object",
        "additionalProperties": false,
        "required": ["level", "targetTimeline"],
        "properties": {
          "level": {"type": "string", "pattern": "^S[0-5]$"},
          "targetTimeline": {"type": "string"},
          "requiresContainment": {"type": "boolean"},
          "requiresEvidencePreservation": {"type": "boolean"}
        }
      }
    },
    "dataGovernance": {
      "type": "object",
      "additionalProperties": false,
      "required": ["userRecordsPlane", "safetyEvidencePlane", "rawAudioVideoDefault"],
      "properties": {
        "userRecordsPlane": {"type": "string"},
        "safetyEvidencePlane": {"type": "string"},
        "rawAudioVideoDefault": {"type": "string", "enum": ["off", "on-with-consent"]}
      }
    },
    "jurisdiction": {
      "type": "object",
      "additionalProperties": false,
      "required": ["packRef", "reviewed", "defaultWhenUncertain"],
      "properties": {
        "packRef": {"type": ["string", "null"]},
        "reviewed": {"type": "boolean"},
        "defaultWhenUncertain": {"type": "string", "const": "stricter-policy"}
      }
    },
    "launchGate": {
      "type": "object",
      "additionalProperties": false,
      "required": ["providerMinorInteractionEnabled", "requiresReviewedJurisdictionPack"],
      "properties": {
        "providerMinorInteractionEnabled": {"type": "boolean"},
        "requiresReviewedJurisdictionPack": {"type": "boolean", "const": true}
      }
    },
    "receiptSafety": {"$ref": "#/$defs/receiptSafety"},
    "issuedAt": {"type": "string"},
    "labels": {"type": "object", "additionalProperties": {"type": "string"}}
  },
  "$defs": {
    "receiptSafety": {
      "type": "object",
      "additionalProperties": false,
      "required": ["includeRawContent", "secretValuesIncluded", "privateMemoryIncluded"],
      "properties": {
        "includeRawContent": {"type": "boolean", "const": false},
        "secretValuesIncluded": {"type": "boolean", "const": false},
        "privateMemoryIncluded": {"type": "boolean", "const": false}
      }
    }
  }
}
